{"artifact_refs":{"S1-A":{"digest":"sha256:de1eb690e02f3e697d759894d6ecdf6c2dfbfc1312386cd82d652657718038a1"},"S1-B":{"digest":"sha256:2ad53becfaa8dd4b84b9e79e78292a3e5cf3dc0f166a7f283d473a28fd14e8a0"},"S1-C":{"digest":"sha256:08ea5ebb8cd70a2671895bd5f77148247907b66119af9ada2ad027fab8ec0f4b"},"S1-D":{"digest":"sha256:330467fa7c297f71ce3dc0a2ff847bb8eb7d53b8d10fe68562e0e046e8c57f9e"}},"finding_validation_ref":{"digest":"sha256:e402a9390ccb4e0e785300b40f6c6da7e0105c6edd5963b5924e3df1c636e30b"},"group_id":"bootstrap-and-shared-closure","result":"passed","result_refs":{"S1-A":{"digest":"sha256:cbd4b6e87e7dbdb3956f4f150eb3a94edf7393a8913a8c4934a9d18cc4cc2eed"},"S1-B":{"digest":"sha256:39aa4f3560696c8bacfea669bd445d6b9c1394963dc67ba2a875a7ec0f6aecff"},"S1-C":{"digest":"sha256:0f6bf8f56ad9455bd7de8e582239ae3ca1f6e1abc3b6fc03df2b9432fefcf4ee"},"S1-D":{"digest":"sha256:6c5c1d6254393ca4be8990dc854acf0edb14d886ed8b6fafc19f679d98eef6f1"}},"review_ref":{"digest":"sha256:9e66e307f2632239598556c504abf56695b4a9518b87c087470f111dbc209820"},"run_id":"s1-source-close-2026-09-05","schema":"section-accepted-result/v1","section_id":"S1"}
