{"artifact_refs":{"S0-A":{"digest":"sha256:879d4fee322a2c46abd1421048af0f3609ae2cfe0faba447688562a2aaaa9421"},"S0-B":{"digest":"sha256:456238826773ec156043c53abc84f58937ff9dd52a795b89829781550f6c45fe"},"S0-C":{"digest":"sha256:58e5b6f03b4f816ddd53cdeadff3dd30af815ddea5cd39790db9294aee198ce2"},"S0-D":{"digest":"sha256:9d79bd5f0f55c59550e5c7413bfc59a6af03767f1d5541a4cdd396e7f8f00d03"}},"finding_validation_ref":{"digest":"sha256:f4a268d84ccd2ddae8c886a18f03fb940e4ff62ced6f95a93d9d1169d301799f"},"group_id":"contracts-and-schema","result":"passed","result_refs":{"S0-A":{"digest":"sha256:35e60c21567d26d22ec87a424a2b9e81803ee3648a4e10429e7daef0497281e0"},"S0-B":{"digest":"sha256:77458375520cc13d039da73d9d96793396e809f8e242ccce3d9f87b5ecaab9ba"},"S0-C":{"digest":"sha256:b93134efac242540641cb05fa6c6ad51d9889fe73a64fce2a4a9c0004e7381b6"},"S0-D":{"digest":"sha256:ad621f52929684afeeee018d2f205e8bad6f83276b99d3b057708a1d7261da6b"}},"review_ref":{"digest":"sha256:abc37c4e16efd0ee2a296bb4571b6e488e86d3d7ac304f95303779fff6be3ce3"},"run_id":"s0-source-transition-2026-09-04","schema":"section-accepted-result/v1","section_id":"S0"}
